Recipe_No,Unnamed: 0,title,ingredients,directions,link,source,NER
1,2015528,Marinated Flank Steak Recipe,"[""1 1/2 pound flank steak"", ""1/2 c. finely minced green onions (scallions)"", ""1/2 c. dry red wine"", ""1/4 c. soy sauce"", ""3 tbsp. salad oil"", ""3 teaspoon sesame seeds"", ""2 teaspoon packed brown sugar"", ""1/4 teaspoon grnd black pepper"", ""1/4 teaspoon grnd ginger"", ""1 clove garlic, chopped""]","[""Remove tenderloin from steak."", ""Score meat."", ""Combine remaining ingredients and pour over meat."", ""Let marinate 24 hrs."", ""Preheat grill."", ""Broil or possibly grill."", ""Slice thinly on an angle against the grain.""]",cookeatshare.com/recipes/marinated-flank-steak-20757,Recipes1M,"[""flank steak"", ""green onions"", ""red wine"", ""soy sauce"", ""salad oil"", ""sesame seeds"", ""brown sugar"", ""grnd black pepper"", ""grnd ginger"", ""clove garlic""]"
2,1608734,French Chicken Stew,"[""1 tablespoon rosemary"", ""1 teaspoon thyme"", ""3 bay leaves"", ""1 teaspoon smoked paprika"", ""1 teaspoon pepper"", ""1/4 cup red wine"", ""3 cups chicken broth"", ""2 cups button mushrooms sliced"", ""2 cups mushroom mix, oyster, shiitake, baby bella, sliced"", ""2 medium carrots sliced diagonally"", ""1 onion medium, chopped"", ""1 red potato medium, cut in 1-inch pieces"", ""1 cup frozen green beans 1-inch pieces"", ""1/2 can black olives pitted ripe, halved"", ""1 handful grape tomatoes halved"", ""8 chicken thighs with bones and skin. 2-3 lbs"", ""2 stalks celery"", ""3 cups water""]","[""combine all ingredients in slow cooker (6 quarts). bury chicken in vegetables. don't put herbs directly on chicken (because skin is removed later)"", ""add enough broth and water to cover most of ingredients. liquid level rises a good amount during cooking, so careful with filling the slow cooker too much."", ""turn slow cooker on low for 6-7 hours or high 3-4 hours. Note: in my newer Crock-Pot this was enough time, but in my parents' older Crock-Pot 7 hours on low was not enough (don't know how long would be good. we left the veggies a little tough)."", ""pull out all chicken."", ""skim off fat from top with spoon"", ""pull off skin and remove bones from chicken. shred and return to soup.""]",www.yummly.com/recipe/French-Chicken-Stew-1433580,Gathered,"[""rosemary"", ""thyme"", ""bay leaves"", ""paprika"", ""pepper"", ""red wine"", ""chicken broth"", ""button mushrooms"", ""mushroom mix"", ""carrots"", ""onion"", ""frozen green beans"", ""black olives"", ""handful grape tomatoes"", ""chicken"", ""stalks celery"", ""water""]"
3,778500,Glazed Carrots,"[""3 to 4 carrots"", ""1 1/2 Tbsp. butter"", ""1/3 c. brown sugar"", ""grated lemon rind and juice""]","[""Cook 3 to 4 carrots; cut crosswise in 1-inch pieces."", ""Add butter, brown sugar (packed) and grated lemon rind and juice to taste."", ""Heat slow, stirring occasionally, until nicely glazed, about 15 minutes."", ""Makes 2 to 3 servings.""]",www.cookbooks.com/Recipe-Details.aspx?id=1011892,Gathered,"[""carrots"", ""butter"", ""brown sugar"", ""lemon rind""]"
4,1334975,Moms Pie Dough ,"[""4.5 Cups Flour"", ""1.5 Tsp Salt"", ""Pinch Baking Powder"", ""1 Tbls Sugar"", ""1 2/3 cup Crisco"", ""1 egg lightly beaten"", ""1 tsp vinegar"", ""Ice Water""]","[""Mix all dry ingredients in a bowl."", """", ""Add crisco and cut in with dough cutter."", """", ""Mix wet ingredients adding ice water to make 1 total cup of wet ingredients."", """", ""Add wet to dry, starting with 1/2 cup of wet ingredients."", """", ""Make dough and chill""]",www.epicurious.com/recipes/member/views/moms-pie-dough-50099408,Gathered,"[""Flour"", ""Salt"", ""Baking Powder"", ""Sugar"", ""Crisco"", ""egg"", ""vinegar"", ""Water""]"
5,116562,Pretzel Salad Or Dessert,"[""2 c. crushed small thin pretzels (sticks)"", ""3/4 c. margarine""]","[""Mix and press in baking pan, approximately 13 x 9-inch. Bake 8 minutes at 400\u00b0. Cool.""]",www.cookbooks.com/Recipe-Details.aspx?id=106723,Gathered,"[""thin pretzels"", ""margarine""]"
6,1712896,Citrus Syrup,"[""3/4 cup sugar"", ""1/2 cup fresh orange juice"", ""1/2 cup fresh lemon juice""]","[""In a 1 1/2-quart saucepan stir together sugar and juices and simmer, stirring occasionally, 5 minutes, or until sugar is dissolved and syrup is slightly thickened."", ""Cool syrup."", ""Syrup may be made 3 days ahead and chilled, covered."", ""Makes about 1 1/4 cups.""]",www.epicurious.com/recipes/food/views/citrus-syrup-100938,Recipes1M,"[""sugar"", ""orange juice"", ""lemon juice""]"
7,1306450,Cranberry And Candied Orange Chutney ,"[""1 large navel orange with skin"", ""7 cups water, divided"", ""1/2 cup sugar"", ""2 cinnamon sticks, divided"", ""1/4 cup (packed) golden brown sugar"", ""1 tablespoon dark rum"", ""2 teaspoons apple cider vinegar"", ""1/8 teaspoon ground allspice"", ""1/2 cup fresh or frozen cranberries""]","[""Cut orange into 1/4-inch-thick rounds; cut rounds into 1/4-inch cubes. Place in heavy medium saucepan; add 3 cups water. Bring to boil. Reduce heat and simmer 10 minutes. Drain, rinse, and drain well. Boil again with 3 cups water; rinse and drain."", ""Return orange cubes to same pan. Add 3/4 cup water, 1/2 cup sugar, and 1 cinnamon stick. Bring to boil, stirring until sugar dissolves. Boil gently until all liquid evaporates, about 30 minutes."", ""Bring brown sugar, rum, vinegar, allspice, 1/4 cup water, and 1 cinnamon stick to boil in saucepan. Mix in cranberries. Cook until thick syrup forms, stirring occasionally, about 10 minutes. Mix in orange; cook 1 minute. Transfer chutney to small bowl; cool. (Can be made 2 days ahead. Cover; chill.)""]",www.epicurious.com/recipes/food/views/cranberry-and-candied-orange-chutney-233172,Gathered,"[""orange with skin"", ""water"", ""sugar"", ""cinnamon sticks"", ""golden brown sugar"", ""dark rum"", ""apple cider vinegar"", ""ground allspice"", ""cranberries""]"
8,1345812,Tau Kua He Ci Medan'S Favourite Food ,"[""1 slices Gravy ingredients (A) - onion"", ""3 cloves Gravy ingredients (A) - cloves garlic"", ""300 grams Gravy ingredients (A) - very ripe tomatoes (chopped)"", ""300 grams Gravy ingredients (A) - pineappled (chopped)"", ""6 tablespoons Gravy ingredients (A) - tomato sauce ( i use Del Monte)"", ""3 tablespoons Gravy ingredients (A) - sugar ( to taste)"", ""1 tablespoon Gravy ingredients (A) - salt & pepper"", ""3 liters Gravy ingredients (A) - water"", ""200 grams Gravy ingredients (B) - pineappled (chopped)"", ""3 tablespoons Gravy ingredients (B) - corn starch to dissolve in water""]","[""The condiments:"", ""- Large prawns, fried in batter"", ""- Small blue swimming crab, fried in batter"", ""- small - medium size prawn, made into crackers"", ""- 1 bunch of morning glory, boil until ready"", ""- 200 gr bean sprout, blanched"", ""- make birds eye chilli sauce"", ""The Gravy :"", ""- Bring water to a boil, put all ingredients for gravy and continue to cooke for 10 minutes, simmer for another 1 hour or until the tomato is softened or the water has reduced to 2 - 2.5 L"", ""- Put the tomato stock back in the pot, add in the dissolved corn starch, mix well and bring back to a boil, the gravy now should thickened. If you prefer the gravy slightly runny use 2 tbsp of corn starch but if you wish thicker use 3 tbsp."", ""- The gravy is now ready to use""]",www.epicurious.com/recipes/member/views/tau-kua-he-ci-medans-favourite-food-5b1e3c5cae9b4a38dd3df825,Gathered,"[""Gravy ingredients"", ""garlic"", ""Gravy ingredients"", ""Gravy ingredients"", ""Gravy ingredients"", ""Gravy ingredients"", ""Gravy ingredients"", ""liters Gravy ingredients"", ""Gravy ingredients"", ""Gravy ingredients""]"
9,692271,Jamaica Barbecue Sauce,"[""1 1/2 c. cider vinegar"", ""4 tsp. lemon juice"", ""3 tsp. Worcestershire sauce"", ""2 tsp. brown sugar"", ""1 Tbsp. prepared mustard"", ""3/4 tsp. salt"", ""1/2 tsp. meat tenderizer"", ""1 c. tomato catsup"", ""1 Tbsp. liquid smoke"", ""1 tsp. garlic powder"", ""1 tsp. cayenne pepper"", ""1/2 tomato puree""]","[""Mix ingredients well."", ""Pour into jar."", ""Keep in refrigerator until ready to use."", ""Makes 1 3/4 pints.""]",www.cookbooks.com/Recipe-Details.aspx?id=470060,Gathered,"[""cider vinegar"", ""lemon juice"", ""Worcestershire sauce"", ""brown sugar"", ""mustard"", ""salt"", ""tenderizer"", ""tomato catsup"", ""liquid smoke"", ""garlic powder"", ""cayenne pepper"", ""tomato puree""]"
10,633422,Dill Dip,"[""2/3 c. sour cream"", ""2/3 c. Hellmann's mayo"", ""1 Tbsp. parsley flakes"", ""1 Tbsp. dried onion flakes"", ""1 Tbsp. Worcestershire sauce"", ""1 tsp. Accent"", ""1 tsp. season salt"", ""1 tsp. dill weed""]","[""Mix all ingredients together and chill overnight. Great with fresh vegetables.""]",www.cookbooks.com/Recipe-Details.aspx?id=109385,Gathered,"[""sour cream"", ""mayo"", ""parsley flakes"", ""onion"", ""Worcestershire sauce"", ""Accent"", ""season salt"", ""dill weed""]"
11,1498855,"Crab, Grapefruit And Watercress Salad","[""3 tablespoons champagne vinegar"", ""3 tablespoons honey"", ""2 tablespoons chopped sweet onion"", ""1 teaspoon Dijon mustard"", ""1/2 teaspoon sea salt"", ""1/2 cup canola oil"", ""1 tablespoon poppy seeds"", ""2 cans (6-1/2 ounces each) jumbo lump crabmeat, drained {Maria: the flavor of jumbo lump crabmeat is much better than plain old lump crabmeat plus it's more tender, so please be sure to get jumbo. thx!}"", ""6 cups watercress"", ""2-1/2 cups fresh grapefruit segments"", ""12 cherry tomatoes, halved"", ""1 medium ripe avocado, peeled, pitted and sliced"", ""1-1/2 teaspoons white grapefruit juice""]","[""Process first five ingredients in a blender or food processor until smooth. While processing, gradually add oil in a steady stream until dressing thickens. Pour into a serving bowl; stir in poppy seeds."", ""Transfer 1/4 cup salad dressing to a small bowl. Toss with crab. Add remaining ingredients to serving bowl; gently toss until combined. Top with crab mixture.""]",www.tasteofhome.com/recipes/crab-grapefruit-and-watercress-salad/,Gathered,"[""champagne vinegar"", ""honey"", ""sweet onion"", ""mustard"", ""salt"", ""canola oil"", ""poppy seeds"", ""jumbo lump crabmeat"", ""watercress"", ""fresh grapefruit segments"", ""cherry tomatoes"", ""avocado"", ""white grapefruit juice""]"
12,1632674,Sloppy Joe Grilled Cheese,"[""1 pound ground beef"", ""1/4 cup chopped onion"", ""2 tablespoons prepared mustard depending on your tastebuds"", ""1/2 cup ketchup"", ""1/4 cup brown sugar"", ""1/2 tablespoon worcestershire sauce"", ""12 slices Texas toast bread"", ""6 tablespoons butter softened"", ""4 cups shredded cheese or more if you need it""]","[""Read full directions at 5boysbaker.com""]",www.yummly.com/recipe/Sloppy-Joe-Grilled-Cheese-1509365,Gathered,"[""ground beef"", ""onion"", ""tastebuds"", ""ketchup"", ""brown sugar"", ""worcestershire sauce"", ""bread"", ""butter"", ""shredded cheese""]"
13,1636219,Strawberry Tart,"[""1 pie shell Graham Cracker"", ""2 cups low fat milk"", ""1 package sugar free vanilla instant pudding mix"", ""1 teaspoon orange rind grated freshly"", ""2 cups strawberries cleaned &"", ""berries Hauled, other, maybe substituted""]","[""Use an 8- or 9-inch tart pan with removeable bottom."", ""Firmly pat gramham cracker pie shell into tart pan."", ""Set aside. Blend milk with instant pudding mix in deep bowl using a whisk or an electric mixer. Continue mixing at low speed for 1 minute or until pudding is dissolved. Add grated orange rind. Let stand for 5 minutes and pour into pie shell. Let stand for 15 minutes or until set. Arrange strawberries or other berries decoratively over pudding shortly before This recipe is suitable for occasional use. Use unsalted margarine in pie shell.""]",www.yummly.com/recipe/Strawberry-Tart-1674888,Gathered,"[""pie shell"", ""milk"", ""sugar"", ""orange rind"", ""strawberries"", ""berries""]"
14,399226,Broccoli Casserole,"[""2 pkg. chopped broccoli, cooked and drained or fresh"", ""1/2 c. margarine"", ""4 Tbsp. flour"", ""4 chicken bouillons, crushed"", ""2 c. milk"", ""8 oz. pkg. stuffing mix""]","[""Stir margarine, flour, bouillon cubes and milk until thick. Pour over broccoli."", ""Mix stuffing mix according to directions. Sprinkle on top."", ""Add nuts."", ""Bake 30 minutes at 350\u00b0 in 9 x 13-inch pan.""]",www.cookbooks.com/Recipe-Details.aspx?id=232515,Gathered,"[""broccoli"", ""margarine"", ""flour"", ""chicken bouillons"", ""milk"", ""stuffing mix""]"
15,841844,Vegetable Salad,"[""2 cans Veg-All, drained"", ""1 can kidney beans, rinsed and drained"", ""1 can whole corn, drained"", ""1 c. chopped celery"", ""1 green pepper, chopped"", ""1 small onion, chopped"", ""2 Tbsp. flour"", ""3/4 c. sugar"", ""1/2 c. vinegar"", ""2 Tbsp. mustard""]","[""Place Veg-All, kidney beans, whole corn, celery, green pepper and onion in bowl."", ""Combine flour, sugar, vinegar and mustard."", ""In a saucepan, cook until the mixture thickens."", ""Set aside to cool. When cool, pour it over vegetables and mix.""]",www.cookbooks.com/Recipe-Details.aspx?id=179534,Gathered,"[""Veg-All"", ""kidney beans"", ""corn"", ""celery"", ""green pepper"", ""onion"", ""flour"", ""sugar"", ""vinegar"", ""mustard""]"
16,2007310,Easy Rhubarb Jam Recipe,"[""5 c. cut-up rhubarb"", ""3 c. sugar""]","[""Cook till rhubarb is soft."", ""Then add in 1 c. cherry pie mix."", ""Heat till boiling, add in 1 small box cherry Jello."", ""Mix well."", ""Put in containers and seal."", ""You can use apricot pie mix and apricot Jello instead.""]",cookeatshare.com/recipes/easy-rhubarb-jam-16644,Recipes1M,"[""rhubarb"", ""sugar""]"
17,1073484,Portzelky (New Year'S Cookies),"[""1 teaspoon sugar"", ""1/2 cup lukewarm water"", ""2 teaspoons active dry yeast"", ""1/2 cup milk"", ""1/2 cup water"", ""1/2 tablespoon salt"", ""1 tablespoon sugar"", ""2 teaspoons baking powder"", ""2 cups raisins (or as many as you would like)"", ""3 egg yolks"", ""3 egg whites, beaten"", ""3 cups flour"", ""oil (for deep frying)""]","[""Dissolve sugar in lukewarm water in a small bowl. Sprinkle with yeast and let stand."", ""Combine milk, water, salt, sugar, baking powder, and raisins in a large bowl or in the bowl of a stand mixer."", ""Beat in egg yolks and yeast."", ""Stir in flour to make a heavy (rather stiff) batter."", ""Fold in egg whites."", ""Cover and set in a warm place until well risen (at least double in bulk). This should take about 2 hours. The end result is a fairly sticky dough."", ""Drop by tablespoonfuls into hot oil (375F) and fry until golden brown.""]",www.food.com/recipe/portzelky-new-years-cookies-277254,Gathered,"[""sugar"", ""water"", ""active dry yeast"", ""milk"", ""water"", ""salt"", ""sugar"", ""baking powder"", ""raisins"", ""egg yolks"", ""egg whites"", ""flour"", ""oil""]"
18,1044068,Frozen Fruit Medley,"[""1 (17 ounce) can apricots or (17 ounce) can peaches"", ""1 (20 ounce) can unsweetend crushed pineapple"", ""1 cup juice or 1 cup syrup, drained from canned fruit"", ""1/2 cup sugar"", ""2 cups strawberries (or 16 oz pkg whole frozen unsweetened berries paritally thawed and separated)"", ""3 bananas, sliced"", ""1 (6 ounce) can frozen orange juice concentrate"", ""2 tablespoons lemon juice""]","[""Drain canned fruits, reserving 1 cup combined syrup."", ""Cook syrup and sugar over medium heat about 5 minutes, stirring until sugar dissolves."", ""In a large bowl, mix all ingredients including syrup together."", ""Using about 2 cups at a time, place mixture in blender."", ""Cover and puree until smooth but slightly chunky."", ""Pour into another large bowl."", ""Repeat until all fruit is processed."", ""When all is blended, stir together in the large bowl."", ""Line 30 muffin cups with paper liners."", ""Ladle fruit into paper cups."", ""Freeze until solid."", ""When frozen, turn over muffin tins and punch out cups with your thumbs."", ""Place cups in freezer bags and store in freezer."", ""Remove from freezer 20 minutes before serving to use as a salad or dessert, or eat frozen.""]",www.food.com/recipe/frozen-fruit-medley-122099,Gathered,"[""peaches"", ""pineapple"", ""syrup"", ""sugar"", ""strawberries"", ""bananas"", ""orange juice"", ""lemon juice""]"
19,1589700,Banana Slush,"[""3 cups Water"", ""2 cups Sugar"", ""177 milliliters Orange Juice Concentrate"", ""6 Tablespoons Lemon Juice"", ""6 whole Ripe Bananas"", ""1.36 liters Pineapple Juice"", ""2 bottles (2-liter Size) Lemon-Line Soda""]","[""Note: The slush mixture makes approximately 1 gallon. Once you mix it with soda, it will make a total of 2 gallons."", ""Start by preparing 2 half-gallon containers that you will use for freezing. You can mix everything in a huge bowl if you have one or divide it as you go, and mix it individually in your containers."", ""Microwave water until very warm. Pour in blender, add sugar and blend until sugar is dissolved. Add orange juice concentrate and lemon juice to blender and blend on high until totally smooth. Add contents of blender to the huge mixing bowl."", ""Add half the bananas and half of the pineapple juice to the blender. Blend on high until smooth. Add contents of the blender to the mixing bowl."", ""Add remaining bananas and pineapple juice to the blender. Blend until smooth. Add to mixing bowl."", ""Mix juices until totally combined. Pour into freezing containers and close them tightly. Freeze about 24 hours until frozen solid."", ""Remove 1/2 gallon frozen slush mixture 1 hour before you are serving it. After letting it thaw on the counter for 1 hour, use a table knife to cut it in two directions. I normally cut it into about 1/2 inch sections. Add 2 liters of soda to a gallon pitcher. Spoon slush mixture into pitcher. Stir gently to combine. Adding the soda first reduces the amount of foam in your pitcher."", ""Repeat previous step if you are making the whole recipe at once. This can also be made in a 2-gallon punch bowl instead of 2 gallon-sized pitchers.""]",tastykitchen.com/recipes/drinks/banana-slush/,Gathered,"[""Water"", ""Sugar"", ""Orange Juice"", ""Lemon Juice"", ""Bananas"", ""Pineapple Juice"", ""bottles""]"
20,1078006,Just Peachy Iced Tea,"[""4 cups water"", ""4 tablespoons sugar, to taste"", ""4 tea bags"", ""1 1/2 cups peach nectar"", ""6 slices peaches (wedges) (optional)""]","[""In a large teapot or pot, combine water and sugar and bring to a boil."", ""Add teabags and let steep for 4-5 minutes or until desired."", ""Take out tea bags."", ""Pour tea into a heat proof pitcher."", ""Add peach nectar, stir."", ""Let cool."", ""Put a peach wedge into each glass."", ""Enjoy!""]",www.food.com/recipe/just-peachy-iced-tea-104410,Gathered,"[""water"", ""sugar"", ""nectar"", ""peaches""]"
21,745320,Caramel Snappers,"[""90 pecan halves (about 1 1/2 c.)"", ""1/2 (14 oz.) pkg. vanilla caramels (about 25)"", ""1 Tbsp. water"", ""1/2 c. semi-sweet chocolate pieces""]","[""To toast pecan halves, spread nuts in a single layer in a shallow baking pan."", ""Toast the nuts in a 350\u00b0 oven about 10 minutes, stirring occasionally.""]",www.cookbooks.com/Recipe-Details.aspx?id=662290,Gathered,"[""pecan"", ""vanilla caramels"", ""water"", ""semi-sweet chocolate pieces""]"
22,293961,Nutty Butty Pie,"[""3 graham cracker crusts"", ""1 (8 oz.) cream cheese"", ""2 (8 oz.) Cool Whip"", ""1 c. whole milk"", ""2 c. 10x confectioners sugar"", ""3/4 c. crunchy peanut butter"", ""1 small can Hershey's chocolate syrup"", ""3/4 c. crushed pecans""]","[""Blend softened cream cheese and milk. Add the confectioners sugar, peanut butter and then add Cool Whip (8 ounces at a time). Fill pie crust with mixture and drool chocolate syrup over filling. Top with pecans. Freeze until firm."", ""Remove from freezer prior to serving.""]",www.cookbooks.com/Recipe-Details.aspx?id=202431,Gathered,"[""graham cracker crusts"", ""cream cheese"", ""milk"", ""confectioners sugar"", ""crunchy peanut butter"", ""chocolate syrup"", ""pecans""]"
23,1985212,Pine Nut Cookie Cups,"[""Nonstick vegetable oil spray"", ""1/2 cup pine nuts, toasted"", ""1/2 cup sugar"", ""1/4 cup all purpose flour"", ""5 tablespoons unsalted butter, melted"", ""2 large egg whites, beaten to blend"", ""1/2 teaspoon vanilla extract"", ""1/3 cup pine nuts, untoasted""]","[""Preheat oven to 350F."", ""Spray large baking sheet with vegetable oil spray."", ""Finely grind 1/2 cup toasted pine nuts with sugar and flour in processor."", ""Transfer to bowl."", ""Mix in butter, egg whites and vanilla."", ""Form 3 cookies by spooning 1 tablespoonful batter for each onto prepared baking sheet, spacing 4 inches apart."", ""Using knife, spread each to 4-inch round."", ""Sprinkle each round with 1 teaspoon untoasted pine nuts."", ""Bake cookies until golden around edges, about 10 minutes."", ""Working quickly, run thin metal spatula around edges of cookies to loosen."", ""Drape each cookie over inverted 3/4-cup custard cup, molding and crimping sides of cookie to shape (cookie cups will be shallow)."", ""Transfer cookies to rack."", ""Repeat with remaining batter and untoasted nuts, spraying baking sheet with vegetable oil spray between batches."", ""Cool before using."", ""(Can be prepared 3 days ahead."", ""Store at room temperature in airtight container.)""]",www.epicurious.com/recipes/food/views/pine-nut-cookie-cups-4434,Recipes1M,"[""vegetable oil spray"", ""pine nuts"", ""sugar"", ""flour"", ""unsalted butter"", ""egg whites"", ""vanilla"", ""pine nuts""]"
24,1929529,Barbecued Beef Brisket Recipe,"[""One brisket, 5 to 6 pounds, trimmed"", ""3 Tbsp. Emeril's Original Essence"", ""1 1/2 tsp salt"", ""1 Tbsp. extra virgin olive oil"", ""1 quart Barbecue Sauce (recipe follows)"", ""2 c. veal stock or possibly canned low-sodium beef broth"", ""2 tsp salt Preheat the oven to 325 degrees F.""]","[""Season the brisket on both sides with the Essence and the salt."", ""Heat a large, heavy skillet or possibly large roasting pan over high heat."", ""Add in the oil and sear the meat till proportionately browned, 2 to 3 min per side."", ""Transfer to a large roasting pan and set aside."", ""Combine the barbecue sauce, veal stock, and salt in a large mixing bowl and mix well."", ""Pour the mix over the brisket and cover tightly with aluminum foil."", ""Bake for 2 1/2 hrs, then turn the meat over and continue cooking for another 2 1/2 hrs."", ""Remove from the oven and let stand for 15 min before carving."", ""Spoon the pan juices over the meat before serving.""]",cookeatshare.com/recipes/barbecued-beef-brisket-78417,Recipes1M,"[""brisket"", ""salt"", ""extra virgin olive oil"", ""Barbecue Sauce"", ""veal stock"", ""salt""]"
25,1603141,Chocolate Oinks,"[""2 1/4 cups flour"", ""1 teaspoon baking soda"", ""1 teaspoon salt"", ""2 sticks butter 1 cup"", ""3/4 cup white sugar"", ""3/4 cup brown sugar"", ""1 1/4 teaspoons vanilla"", ""2 eggs"", ""12 ounces semi sweet chocolate chips Nestle's"", ""1 package thick cut bacon at least 11 slices"", ""1/8 cup brown sugar additional, approximately""]","[""First we cook the bacon. Preheat the oven to 350 degrees. Lay the bacon on a pan with parchment or a Silpat, and sprinkle with brown sugar. Bake for about 12 minutes, flip, then bake 12 minutes more (make sure it's nice and cooked and brown). Let the bacon cool on a rack or on paper towels. Break up into pieces, and press in between more paper towels to remove all the excess grease."", ""Raise oven to 375 degrees. Beat together the butter, sugars, and vanilla. Once lightened and well combined, mix in the two eggs. Add the flour, baking soda, and salt and combine well. Stir in the bag of chocolate chips and the crumbled bacon."", ""Scoop 1 tablespoon sized balls onto a Silpat-lined or greased cookie sheet. I found the cookies took about 10 minutes to bake, but I would check after 9 to see if they are done. Let cool, or enjoy while they are warm and fuzzy.""]",www.yummly.com/recipe/Chocolate-Oinks-1652748,Gathered,"[""flour"", ""baking soda"", ""salt"", ""butter"", ""white sugar"", ""brown sugar"", ""vanilla"", ""eggs"", ""\u2019s"", ""bacon"", ""brown sugar""]"
26,28277,Extra Flaky Pie Crust,"[""3 c. flour"", ""1 tsp. salt"", ""1 Tbsp. vinegar"", ""1 1/4 c. lard"", ""1 egg, well beaten"", ""5 Tbsp. water""]","[""Blend flour, lard and salt; beat the egg and add the vinegar and the water to it and mix.""]",www.cookbooks.com/Recipe-Details.aspx?id=1063099,Gathered,"[""flour"", ""salt"", ""vinegar"", ""lard"", ""egg"", ""water""]"
27,228937,Bacon Quiche Biscuit Cups,"[""1 (8 oz.) cream cheese, softened"", ""2 Tbsp. milk"", ""2 eggs"", ""1/2 c. shredded Swiss cheese"", ""2 Tbsp. chopped green onion"", ""1 (10 oz.) can refrigerator flaky biscuits"", ""5 slices bacon, crisply cooked and finely crumbled""]","[""In small bowl, beat cream cheese, milk and eggs on low speed until smooth."", ""Stir in Swiss cheese and onions; set aside.""]",www.cookbooks.com/Recipe-Details.aspx?id=297855,Gathered,"[""cream cheese"", ""milk"", ""eggs"", ""Swiss cheese"", ""green onion"", ""refrigerator flaky"", ""bacon""]"
