Recipe_No,Unnamed: 0,title,ingredients,directions,link,source,NER
53,368754,Texas Pralines,"[""2 c. granulated sugar"", ""1 tsp. baking soda"", ""1 c. buttermilk"", ""2 c. pecan halves"", ""1 tsp. vanilla"", ""1 Tbsp. butter""]","[""Use a large pot, the candy needs lots of room to bubble."", ""Pour the buttermilk, sugar and baking soda into the pot."", ""Stir the mixture until the sugar is completely dissolved, then place the pot on low to medium heat and let it boil to a soft ball stage, stirring constantly."", ""(Soft ball means dipping a spoon into the candy and letting a small amount drip into cool water."", ""If you can form the syrup into a soft ball with your fingers, it is ready.) The mixture will turn a brownish color, but don't worry, it is supposed to."", ""Once the soft ball stage is reached, remove from heat, then add 2 cups of pecan halves, then the vanilla and butter. Beat the mixture briskly until it becomes glossy and starts to get very thick."", ""Quickly spoon onto greased wax paper, making little patties."", ""Pecan halves may be turned right side up."", ""Let the candy completely cool before removing it from the paper.""]",www.cookbooks.com/Recipe-Details.aspx?id=708652,Gathered,"[""sugar"", ""baking soda"", ""buttermilk"", ""pecan halves"", ""vanilla"", ""butter""]"
54,1101014,French Meringue Strips,"[""3 cups flour"", ""3/4 cup sugar"", ""1/2 teaspoon salt"", ""1 cup butter or 1 cup margarine"", ""2 egg yolks (slightly beaten)"", ""1/8 teaspoon cream of tartar"", ""2 cups powdered sugar"", ""1 teaspoon vanilla"", ""2 egg whites"", ""2 teaspoons sugar"", ""1/2 teaspoon cinnamon"", ""1 1/2 cups slivered almonds (blanched or unblanched)""]","[""In a large bowl, mix together the flour, sugar and salt."", ""Cut in the butter (at room temperature) until particles are the size of small peas. Mix in the egg yolks slightly mixed with enough water to measure 1/3 cup."", ""Sprinkle this over the flour mixture, tossing lightly with a fork until the dough is moist enough to hold together."", ""Form into a ball and chill while making the meringues."", ""Meringue: Beat the egg whites with the cream of tartar for one minute."", ""Gradually add the powdered sugar, beating constantly."", ""Mix in the vanilla."", ""Cover with plastic wrap while rolling out the dough."", ""Roll out the chilled dough on a floured board, pastry cloth or waxed paper."", ""Shape to approximately a 20 x 15 inch rectangle."", ""Spread on the merigue."", ""Combine the sugar, cinnamon and almonds."", ""Sprinkle over the meringue."", ""Press in lightly with a spatula."", ""Cut dough with spatula or sharp knife into 3 x 1 inch strips."", ""Place on ungreased bake sheet."", ""Bake in a 350 degree oven 8-10 minutes, or until they start to delicately brown.""]",www.food.com/recipe/french-meringue-strips-234299,Gathered,"[""flour"", ""sugar"", ""salt"", ""butter"", ""egg yolks"", ""cream of tartar"", ""powdered sugar"", ""vanilla"", ""egg whites"", ""sugar"", ""cinnamon""]"
55,1123353,Puerto Rican Chicken Soup,"[""1 chicken"", ""2 carrots, diced"", ""1 tablespoon garlic powder"", ""1 green bell pepper, diced"", ""1/3 cup brown rice"", ""1 teaspoon chili powder"", ""1 (16 ounce) can tomato sauce"", ""3 garlic cloves"", ""1 teaspoon pepper"", ""6 cups water"", ""1 tablespoon cider vinegar"", ""1 onion, minced"", ""2 tablespoons olive oil"", ""1 bay leaf""]","[""in large stock pot heat oil"", ""add onion, carrots and green pepper, saute"", ""add rice, chili and pepper, saute"", ""add garlic, saute"", ""add water, garlic powder, tomato sauce, chicken, bay leaf and vinegar."", ""cook for 1 hour covered until chicken is done."", ""take chicken out and debone add chunks of chicken back inches."", ""remove bay leaves.""]",www.food.com/recipe/puerto-rican-chicken-soup-486878,Gathered,"[""chicken"", ""carrots"", ""garlic"", ""green bell pepper"", ""brown rice"", ""chili powder"", ""tomato sauce"", ""garlic"", ""pepper"", ""water"", ""cider vinegar"", ""onion"", ""olive oil"", ""bay leaf""]"
56,1032842,Sweet Potato Salad,"[""3 lbs sweet potatoes, unpeeled, diced & steamed"", ""1 cup green bell pepper, diced"", ""1/2 cup onion, finely chopped"", ""1/4 teaspoon lemon pepper"", ""1 1/4 cups mayonnaise"", ""1 dash hot pepper sauce (optional)""]","[""In a large bowl, combine the first 4 ingredients."", ""Stir in the mayonnaise (& hot pepper sauce, if using), mixing well."", ""Cover & refrigerate at least 1 hour before serving.""]",www.food.com/recipe/sweet-potato-salad-452286,Gathered,"[""sweet potatoes"", ""green bell pepper"", ""onion"", ""lemon pepper"", ""mayonnaise"", ""pepper""]"
57,331561,Sugar Cookie I,"[""1 1/2 c. brown sugar"", ""1 1/2 c. white sugar"", ""3 eggs"", ""1 1/2 c. butter or margarine"", ""4 1/2 c. flour"", ""1 1/2 tsp. baking soda"", ""1/4 tsp. vanilla extract""]","[""Cream sugars, eggs and butter."", ""Add vanilla and dry ingredients; mix thoroughly."", ""Drop teaspoonfuls on cookie sheet. Flatten with spatula dipped in water."", ""Sprinkle with white sugar and cinnamon."", ""Bake at 350\u00b0.""]",www.cookbooks.com/Recipe-Details.aspx?id=162001,Gathered,"[""brown sugar"", ""white sugar"", ""eggs"", ""butter"", ""flour"", ""baking soda"", ""vanilla extract""]"
58,1276424,Hoisin-Glazed Cornish Hen ,"[""1 (1 1/2-pound) Cornish hens"", ""Vegetable oil, for frying"", ""1/2 cup hoisin"", ""1/4 cup honey"", ""1/2 teaspoon red pepper flakes"", ""1/4 cup scallions, sliced""]","[""Directions"", """", ""Preheat oven to 350 degrees F."", """", ""In a very deep pot, bring enough oil to fill the pot by 2/3 of the way. Heat the oil to 350 degrees F."", """", ""Add the hen slowly to the oil and fry for 8 to 10 minutes on each side until golden brown and have reached an internal temperature of 165 degrees F."", """", ""Remove the hen from the oil and drain on a paper towel."", """", ""Whisk together in a large bowl, the hoisin, honey, red pepper flakes, and the scallions. Brush mixture over the cooked hen on both sides and reserve the extra sauce for dipping."", """", ""Place in oven for about 7 minutes. Take out. Flip over and brush reserved hoisin sauce on flipped side. Place in oven for another 7 minutes."", """", ""Recipe courtesy Aaron McCargo Jr.""]",www.epicurious.com/recipes/member/views/hoisin-glazed-cornish-hen-53014801,Gathered,"[""Cornish hens"", ""Vegetable oil"", ""hoisin"", ""honey"", ""red pepper"", ""scallions""]"
59,1223674,Chicken With Mango And Asparagus,"[""1 lb boneless skinless chicken breast, cut into bite-size cubes"", ""1 large egg white, lightly beaten"", ""1 tablespoon cornstarch"", ""2 1/2 tablespoons vodka"", ""1/2 tablespoon canola oil"", ""1/2 cup dry white wine"", ""1 tablespoon low sodium soy sauce"", ""1/2 cup low sodium chicken broth"", ""vegetable oil cooking spray"", ""3 scallions, white part and 2 inches green,cut into 1 inch pieces"", ""1 clove garlic, minced"", ""2 inches fresh ginger, peeled and julienned"", ""1/2 red bell pepper, 3 oz seeded and julienned"", ""6 ounces thin asparagus, cut into 2 inch pieces"", ""1 small ripe mango, 4 oz peeled and cut into chunks""]","[""Place the cubed chicken in a bowl."", ""Add the egg white, cornstarch, vodka, and canola oil."", ""Stir to coat the chicken, then set aside to marinate while you prepare the rest of the recipe."", ""Combine the white wine, soy sauce and chicken stock in a pitcher."", ""Heat a large non stick skillet and spray it with cooking oil."", ""Add the marinated chicken and cook over high heat until lightly browned."", ""Add the scallions, garlic, ginger, red pepper, and asparagus and stir fry for another minute."", ""Slowly stir in the liquid and bring to a boil so that the sauce thickens."", ""Lower the heat and stir in the mango."", ""Cook until heated through."", ""Good served over basmati rice.""]",www.food.com/recipe/chicken-with-mango-and-asparagus-64857,Gathered,"[""chicken breast"", ""egg white"", ""cornstarch"", ""vodka"", ""canola oil"", ""white wine"", ""soy sauce"", ""chicken broth"", ""vegetable oil cooking spray"", ""scallions"", ""clove garlic"", ""ginger"", ""red bell pepper"", ""thin"", ""mango""]"
60,317601,Quick Monkey Bread,"[""1/2 c. chopped pecans (optional)"", ""1/2 c. sugar"", ""1 tsp. ground cinnamon"", ""3 (10 oz.) cans refrigerated buttermilk biscuits"", ""1 c. firmly packed brown sugar"", ""1/2 c. butter or margarine, melted""]","[""Sprinkle pecans evenly in bottom of a well-greased 10-inch Bundt pan."", ""Set pan aside.""]",www.cookbooks.com/Recipe-Details.aspx?id=756058,Gathered,"[""pecans"", ""sugar"", ""ground cinnamon"", ""buttermilk"", ""brown sugar"", ""butter""]"
61,178984,Smore Pie,"[""1 graham cracker crust (9 oz.)"", ""12 oz. chocolate bar, broken in pieces"", ""6 oz. hot fudge (warm)"", ""30 regular marshmallows"", ""3/4 c. milk"", ""2 1/2 c. whipped cream (reserve 1 c. for topping)""]","[""In saucepan, place chocolate bar, milk and marshmallows."", ""Cook over low heat, stirring constantly until melted."", ""Cool."", ""Fold 1 1/2 cups whipped cream into chocolate mix."", ""Spread thin layer of warm hot fudge in bottom of pie crust."", ""Gently spoon cooked mixture into crust."", ""Top with reserved whipped cream and garnish with chocolate syrup topping."", ""Refrigerate for 3 hours.""]",www.cookbooks.com/Recipe-Details.aspx?id=1002291,Gathered,"[""graham cracker crust"", ""chocolate bar"", ""hot fudge"", ""regular marshmallows"", ""milk"", ""whipped cream""]"
62,834573,Stuffed French Toast,"[""1 (16 oz.) French bread loaf, cut into 18 slices"", ""1 (8 oz.) pkg. cream cheese, cut into 1/4-inch slices"", ""1 (3 oz.) pkg. cream cheese, cut into 1/4-inch slices"", ""12 large eggs"", ""2 c. milk"", ""1/3 c. maple syrup"", ""dash of ground cinnamon""]","[""Place 9 French bread slices in single layer in the bottom of a lightly greased 13 x 9 baking dish and top with cream cheese. Place remaining French bread slices on top of cream cheese. Whisk together eggs and the next three ingredients; pour over bread. Cover and chill for 8 hours. Remove from refrigerator and let stand at room temperature 30 minutes before baking. Bake at 350\u00b0 for 45 minutes, shielding with aluminum foil after 20 minutes to prevent excessive browning. Yield: 8 servings.""]",www.cookbooks.com/Recipe-Details.aspx?id=42156,Gathered,"[""bread"", ""cream cheese"", ""cream cheese"", ""eggs"", ""milk"", ""maple syrup"", ""ground cinnamon""]"
63,1716516,Rich Pastry Crust,"[""2 1/2 cups flour, all-purpose"", ""1 teaspoon salt"", ""1/2 cup lard"", ""1/4 cup schmaltz (chicken fat) cold"", ""6 tablespoons water""]","[""Combine flour and salt."", ""Cut in lard and reserved cold chicken fat until size of small peas."", ""Add water by tablespoons, tossing with fork until all flour is moistened and dough forms ball.""]",recipeland.com/recipe/v/rich-pastry-crust-5470,Recipes1M,"[""flour"", ""salt"", ""lard"", ""chicken"", ""water""]"
64,2179744,Great Baguette,"[""2 packages yeast, active dry (quick rise)"", ""3 cups whole wheat flour"", ""1/2 tablespoon sugar"", ""1 cup flour, unbleached all-purpose white"", ""13 cup water warm"", ""1 x cornmeal"", ""1 teaspoon salt (more or less)"", ""1 cup water""]","[""Melt the yeast, sugar, 13 cup warm water in a bowl and set aside."", ""Mix the flours, salt, in a bowl, add the yeast mix, and then the water."", ""Mix the dough until smooth, about 5 minutes."", ""Let rise covered with a damp cloth for one hour."", ""Punch down, and divide into two or four loaves, then slice tops about 2 inch across, 1/4 inch deep."", ""Place in cold oven set to 350F (180C) F for one hour."", ""For crustier bread, place a pan of water on the bottom of the stove for first 30 minutes, then remove."", ""Also, you can brush the loaves with a mixture of egg-white and 1/2 cup water after 50 minutes.""]",recipeland.com/recipe/v/great-baguette-39665,Recipes1M,"[""yeast"", ""whole wheat flour"", ""sugar"", ""flour"", ""water"", ""cornmeal"", ""salt"", ""water""]"
65,1059409,Easy Bake Oven Orange Cake Mix,"[""1 cup sugar"", ""1 1/2 cups flour"", ""1 teaspoon baking soda"", ""1/2 teaspoon salt"", ""1 teaspoon orange unsweetened flavored drink mix (Kool-aid)"", ""1/3 cup shortening""]","[""In a medium bowl, combine sugar, flour, baking soda, salt and drink powder. Stir with a wire whisk until blended. With a pastry blender, cut in shortening until evenly distributed and mixture resembles corn meal."", ""Spoon about 1/3 cup mixture into each of 10 small containers or ziploc bags. Seal bags tightly. Label with date and contents."", ""Store in a cool dry place. Use within 12 weeks."", ""Makes 10 packages Cake Mix."", ""----------------------------."", ""TO USE:."", ""1 pkg. Children's Orange Cake Mix (above)."", ""4 teaspoons water."", ""Preheat oven for 15 minutes."", ""Grease and flour a 4 inch miniature cake pan. In a small bowl, combine cake mix and water. Stir with a fork or spoon until blended and smooth."", ""Pour mixture into prepared pan. Bake 12 to 13 minutes in play oven. Remove from oven. Cool in pan on rack for 5 minutes. Invert cake onto a small plate. Remove pan."", ""When cool, frost with Children's White Frosting if desired.""]",www.food.com/recipe/easy-bake-oven-orange-cake-mix-156132,Gathered,"[""sugar"", ""flour"", ""baking soda"", ""salt"", ""orange"", ""shortening""]"
66,1092362,Russian Salad Dressing,"[""1/4 cup sugar (or honey)"", ""3 tablespoons water"", ""1 cup vegetable oil"", ""1/2 cup catsup"", ""2 -3 tablespoons lemon juice"", ""1 teaspoon vinegar"", ""1/2 teaspoon salt"", ""1/2 teaspoon paprika"", ""1 1/2 teaspoons celery seeds"", ""1 tablespoon Worcestershire sauce"", ""1/4 cup grated onion (or 1/2 tbsp onion powder)""]","[""In a sauce pan cook sugar and water until thick."", ""Cool syrup."", ""Combine the remaining ingredients."", ""Add syrup and whisk to blend well.""]",www.food.com/recipe/russian-salad-dressing-87710,Gathered,"[""sugar"", ""water"", ""vegetable oil"", ""catsup"", ""lemon juice"", ""vinegar"", ""salt"", ""paprika"", ""celery seeds"", ""Worcestershire sauce"", ""onion""]"
67,832974,14 Layer Chocolate Cake,"[""1/2 c. vegetable shortening"", ""6 eggs"", ""1 c. milk"", ""2 tsp. vanilla"", ""1 stick margarine"", ""2 c. sugar"", ""3 c. self-rising flour""]","[""Mix all ingredients as for any layer cake."", ""Batter will be thinner than usual."", ""Put 4 tablespoons of batter into greased and floured cake pan."", ""Bump pans gently with hands to spread batter over the entire pan. Bake at 350\u00b0 for 5 to 7 minutes. Do not cook too long or allow layer to get brown."", ""Partially cool before removing from pan.""]",www.cookbooks.com/Recipe-Details.aspx?id=813292,Gathered,"[""vegetable shortening"", ""eggs"", ""milk"", ""vanilla"", ""margarine"", ""sugar"", ""flour""]"
68,398973,Todd'S Hamburger And Potatoes,"[""1 1/2 lb. lean ground beef"", ""4 to 5 medium potatoes, peeled and thinly sliced"", ""1 envelope onion soup mix"", ""1 can cream of mushroom soup"", ""1 c. water"", ""2 c. crushed plain potato chips"", ""salt"", ""pepper""]","[""Preheat oven to 350\u00b0."", ""Season hamburger meat with pepper while browning."", ""Drain off grease."", ""In separate saucepan combine both soups and water over low heat."", ""Line potato slices in a 10 x 13-inch buttered baking dish."", ""Lightly salt and pepper."", ""Lay ground beef on top of potatoes."", ""Pour soup mixture over top."", ""Cover dish with aluminum foil, piercing a small hole in the center."", ""Bake covered for 25 minutes."", ""Remove foil and top with potato chips. Bake for 20 minutes more.""]",www.cookbooks.com/Recipe-Details.aspx?id=329468,Gathered,"[""lean ground beef"", ""potatoes"", ""onion soup"", ""cream of mushroom soup"", ""water"", ""potato chips"", ""salt"", ""pepper""]"
69,1578268,Hot & Sour Soup,"[""1 Tablespoon Peanut Oil"", ""1 teaspoon Ginger, Finely Chopped"", ""3 cups, 12 tablespoons, 2-1/2 teaspoons, 1-5/8 pinches Vegetable Stock"", ""7 ounces, weight Rice Noodles"", ""1 Tablespoon Oyster Sauce"", ""1 teaspoon Dark Soy Sauce"", ""2 Tablespoons Fish Sauce"", ""1 whole Thick Red Hot Chili Pepper, Deseeded And Thinly Sliced"", ""2 whole Small Garlic Cloves, Minced"", ""10 whole Tiger Shrimp, Tails On"", ""1 whole Lime, Juiced"", ""1 pinch Sugar"", ""2 whole Green Onions, Thinly Sliced"", ""1/4 cups Cilantro Leaves, Plus Extra For Garnish"", ""Salt And Pepper, to taste""]","[""1. Add the oil to a large saucepan and add in the ginger over high heat. Fry for a few seconds and then pour in the vegetable stock."", ""2. Bring to a boil, then reduce and simmer for 10 minutes."", ""While the stock heats up, cook the rice noodles according to package directions. For large noodles, boil for 6 minutes and then drain. Keep warm."", ""3. Add the oyster sauce, soy sauce, fish sauce, hot chili pepper and garlic to the stock and reduce heat, simmering for 5 minutes. Add in the shrimp and continue simmering for a further 5 minutes, until the shrimp is cooked."", ""4.Add the lime juice, sugar, green onions and cilantro to. Season to taste with salt and pepper."", ""5. Run the noodles under hot water to prevent sticking and divide among two bowls. Remove the shrimp from the soup and set aside for a moment. Pour the stock over top of the noodles and arrange the shrimp on top. Add a bit of fresh cilantro on top to garnish.""]",tastykitchen.com/recipes/soups/hot-sour-soup-3/,Gathered,"[""Peanut Oil"", ""Ginger"", ""Vegetable Stock"", ""Noodles"", ""Oyster Sauce"", ""Soy Sauce"", ""Fish Sauce"", ""Pepper"", ""Garlic"", ""Shrimp"", ""Sugar"", ""Green Onions"", ""\u00bc"", ""Salt""]"
70,1493040,Herb Fryer Chicken,"[""1/3 cup lemon juice"", ""1/4 cup olive oil"", ""1/4 cup minced fresh parsley"", ""2 tablespoons finely chopped onion"", ""3 garlic cloves, minced"", ""1 tablespoon grated lemon peel"", ""1 teaspoon minced fresh thyme"", ""1/2 teaspoon salt"", ""1/4 teaspoon pepper"", ""1 broiler/fryer chicken (3 pounds), cut up""]","[""In a large resealable plastic bag, combine the lemon juice, oil, parsley, onion, garlic, lemon peel, thyme, salt and pepper; add chicken. Seal bag and turn to coat; refrigerate overnight, turning occasionally. Drain and discard marinade."", ""Grill chicken, covered, over medium heat for 35-40 minutes or until juices run clear, turning every 15 minutes.""]",www.tasteofhome.com/recipes/herb-fryer-chicken/,Gathered,"[""lemon juice"", ""olive oil"", ""fresh parsley"", ""onion"", ""garlic"", ""thyme"", ""salt"", ""pepper"", ""chicken""]"
71,468899,Sheep-Wagon Carrot Cake,"[""1 1/3 c. sugar"", ""1 1/3 c. water"", ""1 c. raisins"", ""1 Tbsp. butter"", ""2 large, grated carrots"", ""1 tsp. cinnamon"", ""1 tsp. cloves"", ""1 tsp. nutmeg"", ""1 c. chopped walnuts"", ""2 1/2 c. sifted flour"", ""2 tsp. baking powder"", ""1 tsp. baking soda"", ""1/2 tsp. salt""]","[""Combine first 8 ingredients in medium saucepan."", ""Simmer for 5 minutes, then cover and let rest for 12 hours.""]",www.cookbooks.com/Recipe-Details.aspx?id=800260,Gathered,"[""sugar"", ""water"", ""raisins"", ""butter"", ""carrots"", ""cinnamon"", ""cloves"", ""nutmeg"", ""walnuts"", ""flour"", ""baking powder"", ""baking soda"", ""salt""]"
72,1167402,Maypo Cookies,"[""1 cup shortening"", ""2 eggs"", ""3/4 cup brown sugar"", ""3/4 cup white sugar"", ""1 1/2 cups flour"", ""1 teaspoon salt"", ""1 teaspoon baking soda (dissolved in 1T hot water)"", ""1 cup maypo"", ""1 teaspoon vanilla"", ""1 cup nuts"", ""1 bag butterscotch chips or 1 bag chocolate chips""]","[""Cream 1 cup shortening."", ""Beat in: eggs, brown sugar, and white sugar."", ""Add flour, salt, soda dissolved in 1 T hot water."", ""Stir in: Maypo, vanilla, nuts, butterscotch and/or chocolate chips."", ""Bake at 350 for 12 minutes on an ungreased cookie sheet.""]",www.food.com/recipe/maypo-cookies-24526,Gathered,"[""shortening"", ""eggs"", ""brown sugar"", ""white sugar"", ""flour"", ""salt"", ""baking soda"", ""maypo"", ""vanilla"", ""nuts"", ""butterscotch chips""]"
73,1774769,Cranberry Caramel Streusel Squares,"[""1 12 cups all-purpose flour"", ""12 cup icing sugar"", ""23 cup butter, chilled and cut into chunks"", ""12 cup all-purpose flour"", ""12 cup quick-cooking oats"", ""2 tablespoons brown sugar"", ""2 tablespoons granulated sugar"", ""14 teaspoon baking soda"", ""14 cup butter, melted"", ""1 (284 ml) can caramel sauce"", ""13 cup all-purpose flour"", ""1 cup cranberries (fresh or frozen)"", ""10 ounces dates, pitted and chopped"", ""1 cup pecans, coarsely chopped""]","[""Preheat the oven to 350 degrees F."", ""Grease a 9\"" x 13\"" pan and set aside."", ""In a medium-size bowl, using a fork, stir the flour with the icing sugar until blended."", ""Using a pastry blender or 2 knives, cut in the butter until the mixture is crumbly."", ""Turn the mixture into the baking dish."", ""Press firmly and evenly over the bottom of the dish."", ""Bake in the centre of the oven until the edges are golden, from 20 to 25 minutes."", ""Remove from the oven."", ""Meanwhile, in a medium-size bowl, stir 1/2 cup flour with the oats, brown sugar, granulated sugar and baking soda."", ""Stir in the melted butter until the mixture is crumbly."", ""Set aside."", ""In a large bowl, stir the caramel sauce with 1/3 cup flour."", ""Stir in the cranberries, dates and pecans."", ""Spread the filling mixture over top the warm baked base, making sure the cranberries and dates are evenly distributed."", ""Sprinkle with the streusel mixture."", ""Return to the oven."", ""Bake until the top is light brown, from 35 to 40 minutes."", ""Remove from the oven."", ""Cool on a rack at least 30 minutes."", ""Cut into 24 squares, then cool completely in the baking dish."", ""Store in an airtight container in the refrigerator up to 1 week or freeze up to 3 months.""]",www.food.com/recipe/cranberry-caramel-streusel-squares-218404,Recipes1M,"[""flour"", ""icing sugar"", ""butter"", ""flour"", ""oats"", ""brown sugar"", ""sugar"", ""baking soda"", ""butter"", ""caramel sauce"", ""flour"", ""cranberries"", ""dates"", ""pecans""]"
74,1906021,Herbed Biscuit Ham Sandwiches,"[""8 tablespoons cold unsalted butter, cubed"", ""2 cups all-purpose flour, plus additional for work surface"", ""1 teaspoon sugar"", ""1 tablespoon baking powder"", ""14 teaspoon kosher salt"", ""34 teaspoon baking soda"", ""2 tablespoons choppped fresh dill"", ""2 tablespoons chopped of fresh mint"", ""2 tablespoons chopped flat leaf parsley"", ""2 tablespoons chopped fresh tarragon"", ""34 cup buttermilk"", ""mustard"", ""honey (optional)"", ""sliced ham"", ""bread and butter pickles""]","[""Preheat oven to 450 deg F. Put cubed butter in freezer."", ""Combine flour, sugar, baking powder, salt, baking soda and herbs in a food processor pulse to combine."", ""If you do not have all the herbs, just use more of the others, so that you have 1/2 cup total."", ""Drop in butter cubes and pulse until mixture resembles coarse cornmeal."", ""Pour in buttermilk and pulse until mixture just comes together."", ""Turn dough out onto a lightly floured surface."", ""Pat into a rectangle, then cut into thirds."", ""Stack thirds on top of each other and pat out into a rectangle again."", ""Repeat twice, then pat into a 4x12 inch rectangle."", ""Cut in half lengthwise and then into 8 square biscuits."", ""Bake on a parchment-lined baking sheet until puffed and golden, 10-12 minutes."", ""Split biscuits and spread with mustard and honey."", ""Top with ham and pickles and make into sandwiches.""]",www.food.com/recipe/herbed-biscuit-ham-sandwiches-515539,Recipes1M,"[""cold unsalted butter"", ""flour"", ""sugar"", ""baking powder"", ""kosher salt"", ""baking soda"", ""dill"", ""mint"", ""flat leaf parsley"", ""tarragon"", ""buttermilk"", ""mustard"", ""honey"", ""ham"", ""bread""]"
75,1274133,Balsamic Salmon Fillets ,"[""\t3/4 pound center-cut salmon fillet, 1-inch thick"", ""\t1 tablespoon olive oil plus more for oiling the fish"", ""\tKosher salt"", ""\tFreshly ground black pepper"", ""\t1/2 teaspoons dried thyme"", ""\t1 tablespoon unsalted butter"", ""\tAged balsamic vinegar or balsamic vinegar reduction for drizzling (optional""]","[""1. Cut the salmon fillet into two equal portions, and brush both sides of each piece with olive oil. Sprinkle with salt, pepper, and the dried thyme."", """", ""2. In a large skillet, heat 1 tablespoon olive oil and the butter on medium-high until the butter foams. Carefully place the fillets flesh-side-down in the skillet."", """", ""3. Cook the fish fillets without moving until the edges begin to crisp, about 2 minutes. Decrease the heat to medium and cook until they are golden brown, about 1 minute more. Turn the fillets so they are skin-side-down and continue cooking until medium rare and the skin is crisped, 5 to 7 minutes depending on their thickness, adding a few additional drops of olive oil as needed to prevent sticking."", """", ""4. Remove the fillets to serving plates and drizzle with balsamic vinegar. Serve immediately""]",www.epicurious.com/recipes/member/views/-balsamic-salmon-fillets-50011675,Gathered,"[""center"", ""olive oil"", ""salt"", ""ground black pepper"", ""thyme"", ""unsalted butter"", ""balsamic vinegar""]"
76,1832412,Pork Rub,"[""2 tablespoons sweet paprika"", ""2 teaspoons ground cumin"", ""2 teaspoons fresh ground pepper"", ""2 teaspoons cocoa powder"", ""1 tablespoon muscovado sugar"", ""1 teaspoon salt""]","[""Mix up all the ingredients."", ""Rub on each side of the pork before either grilling or barbequeing."", ""The rub can be stored in an air tight container."", ""Meat can be marinated in the rub to add a more intense flavour, if doing this add the salt at the last stage."", ""When barbequeing sprinkle some of the rub over the hot coals for a smokey flavour.""]",www.food.com/recipe/pork-rub-261528,Recipes1M,"[""sweet paprika"", ""ground cumin"", ""fresh ground pepper"", ""cocoa powder"", ""muscovado sugar"", ""salt""]"
